[
  {
    "id": "mango-aigc-challenges",
    "name": "芒果灵创赛事中心",
    "url": "https://aigc.mgtv.com/challenges/",
    "source_kind": "official-platform",
    "trust_tier": "official-page",
    "region_codes": ["CN"],
    "industries": ["ai-ml", "film-video", "design"],
    "cadence_hours": 6,
    "enabled": false,
    "collector": { "type": "manual" },
    "notes": "页面由客户端渲染；等待公开接口或专用适配器。"
  },
  {
    "id": "modelscope-events",
    "name": "ModelScope 活动与竞赛",
    "url": "https://modelscope.cn/events",
    "source_kind": "official-platform",
    "trust_tier": "trusted-platform",
    "region_codes": ["CN", "GLOBAL"],
    "industries": ["ai-ml", "data-science", "software"],
    "cadence_hours": 6,
    "enabled": true,
    "collector": {
      "type": "html-links",
      "title_keywords": ["大赛", "竞赛", "挑战赛", "Hackathon", "黑客松", "征集"],
      "link_patterns": ["/events/"],
      "match_mode": "all",
      "reject_past_years": true,
      "title_split_patterns": [" 进行中", " 已结束"],
      "same_host_only": true
    }
  },
  {
    "id": "zcool-events",
    "name": "站酷设计赛事",
    "url": "https://www.zcool.com.cn/event/main.do",
    "source_kind": "official-platform",
    "trust_tier": "trusted-platform",
    "region_codes": ["CN"],
    "industries": ["advertising", "design", "film-video", "photography"],
    "cadence_hours": 6,
    "enabled": false,
    "collector": { "type": "manual" },
    "notes": "公开页对自动化请求返回验证码，遵守站点限制并保持人工核验。"
  },
  {
    "id": "saikr-contests",
    "name": "赛氪竞赛平台",
    "url": "https://www.saikr.com/vs",
    "source_kind": "aggregator",
    "trust_tier": "discovery-only",
    "region_codes": ["CN"],
    "industries": ["education", "innovation", "science-engineering", "software"],
    "cadence_hours": 12,
    "enabled": false,
    "collector": { "type": "manual" },
    "notes": "仅作线索来源；发布前必须回查主办方官网。"
  },
  {
    "id": "moocollege-competitions",
    "name": "全国高校学生竞赛与教师发展数据平台",
    "url": "https://rank.moocollege.com/",
    "source_kind": "official-platform",
    "trust_tier": "trusted-platform",
    "region_codes": ["CN"],
    "industries": ["education", "innovation", "science-engineering"],
    "cadence_hours": 24,
    "enabled": false,
    "collector": { "type": "manual" }
  },
  {
    "id": "alibaba-tianchi",
    "name": "阿里云天池竞赛",
    "url": "https://tianchi.aliyun.com/competition/gameList/activeList",
    "source_kind": "official-platform",
    "trust_tier": "trusted-platform",
    "region_codes": ["CN", "GLOBAL"],
    "industries": ["ai-ml", "data-science", "software"],
    "cadence_hours": 12,
    "enabled": false,
    "collector": { "type": "manual" }
  },
  {
    "id": "baidu-ai-studio",
    "name": "百度 AI Studio 竞赛",
    "url": "https://aistudio.baidu.com/competition",
    "source_kind": "official-platform",
    "trust_tier": "trusted-platform",
    "region_codes": ["CN", "GLOBAL"],
    "industries": ["ai-ml", "data-science", "software"],
    "cadence_hours": 12,
    "enabled": false,
    "collector": { "type": "manual" }
  },
  {
    "id": "datafountain-competitions",
    "name": "DataFountain 竞赛",
    "url": "https://www.datafountain.cn/competitions",
    "source_kind": "official-platform",
    "trust_tier": "trusted-platform",
    "region_codes": ["CN"],
    "industries": ["ai-ml", "data-science", "innovation"],
    "cadence_hours": 12,
    "enabled": false,
    "collector": { "type": "manual" }
  },
  {
    "id": "watcha-activities",
    "name": "微信小程序与数字创意活动",
    "url": "https://watcha.cn/activities",
    "source_kind": "official-platform",
    "trust_tier": "trusted-platform",
    "region_codes": ["CN"],
    "industries": ["design", "innovation", "software"],
    "cadence_hours": 12,
    "enabled": false,
    "collector": { "type": "manual" }
  },
  {
    "id": "china-ministry-education",
    "name": "中华人民共和国教育部",
    "url": "https://www.moe.gov.cn/",
    "source_kind": "government",
    "trust_tier": "official-page",
    "region_codes": ["CN"],
    "industries": ["education", "innovation"],
    "cadence_hours": 24,
    "enabled": false,
    "collector": { "type": "manual" }
  },
  {
    "id": "china-ministry-culture-tourism",
    "name": "中华人民共和国文化和旅游部",
    "url": "https://www.mct.gov.cn/",
    "source_kind": "government",
    "trust_tier": "official-page",
    "region_codes": ["CN"],
    "industries": ["culture-tourism", "design", "film-video"],
    "cadence_hours": 24,
    "enabled": false,
    "collector": { "type": "manual" }
  },
  {
    "id": "china-ministry-science-technology",
    "name": "中华人民共和国科学技术部",
    "url": "https://www.most.gov.cn/",
    "source_kind": "government",
    "trust_tier": "official-page",
    "region_codes": ["CN"],
    "industries": ["innovation", "science-engineering"],
    "cadence_hours": 24,
    "enabled": false,
    "collector": { "type": "manual" }
  },
  {
    "id": "beijing-government-opportunities",
    "name": "北京市人民政府通知公告",
    "url": "https://www.beijing.gov.cn/fuwu/lqfw/gggs/",
    "source_kind": "government",
    "trust_tier": "official-page",
    "region_codes": ["CN-11"],
    "industries": ["culture-tourism", "entrepreneurship", "innovation"],
    "cadence_hours": 24,
    "enabled": false,
    "collector": { "type": "manual" }
  },
  {
    "id": "shanghai-science-notices",
    "name": "上海市科学技术委员会业务通知",
    "url": "https://stcsm.sh.gov.cn/zwgk/tzgs/",
    "source_kind": "government",
    "trust_tier": "official-page",
    "region_codes": ["CN-31"],
    "industries": ["entrepreneurship", "innovation", "science-engineering"],
    "cadence_hours": 24,
    "enabled": false,
    "collector": { "type": "manual" }
  },
  {
    "id": "guangdong-culture-tourism",
    "name": "广东省文化和旅游厅",
    "url": "https://whly.gd.gov.cn/",
    "source_kind": "government",
    "trust_tier": "official-page",
    "region_codes": ["CN-44"],
    "industries": ["culture-tourism", "design", "film-video"],
    "cadence_hours": 24,
    "enabled": false,
    "collector": { "type": "manual" }
  },
  {
    "id": "zhejiang-culture-tourism",
    "name": "浙江省文化广电和旅游厅",
    "url": "https://ct.zj.gov.cn/",
    "source_kind": "government",
    "trust_tier": "official-page",
    "region_codes": ["CN-33"],
    "industries": ["culture-tourism", "design", "film-video"],
    "cadence_hours": 24,
    "enabled": false,
    "collector": { "type": "manual" }
  },
  {
    "id": "jiangsu-culture-tourism",
    "name": "江苏省文化和旅游厅",
    "url": "https://wlt.jiangsu.gov.cn/",
    "source_kind": "government",
    "trust_tier": "official-page",
    "region_codes": ["CN-32"],
    "industries": ["culture-tourism", "design", "film-video"],
    "cadence_hours": 24,
    "enabled": false,
    "collector": { "type": "manual" }
  },
  {
    "id": "hunan-culture-tourism",
    "name": "湖南省文化和旅游厅",
    "url": "https://whhlyt.hunan.gov.cn/",
    "source_kind": "government",
    "trust_tier": "official-page",
    "region_codes": ["CN-43"],
    "industries": ["culture-tourism", "design", "film-video"],
    "cadence_hours": 24,
    "enabled": false,
    "collector": { "type": "manual" }
  },
  {
    "id": "sichuan-culture-tourism",
    "name": "四川省文化和旅游厅",
    "url": "https://wlt.sc.gov.cn/",
    "source_kind": "government",
    "trust_tier": "official-page",
    "region_codes": ["CN-51"],
    "industries": ["culture-tourism", "design", "film-video"],
    "cadence_hours": 24,
    "enabled": false,
    "collector": { "type": "manual" }
  },
  {
    "id": "ningxia-culture-tourism",
    "name": "宁夏回族自治区文化和旅游厅",
    "url": "https://whhlyt.nx.gov.cn/",
    "source_kind": "government",
    "trust_tier": "official-page",
    "region_codes": ["CN-64"],
    "industries": ["culture-tourism", "design"],
    "cadence_hours": 24,
    "enabled": false,
    "collector": { "type": "manual" }
  },
  {
    "id": "kaggle-competitions",
    "name": "Kaggle Competitions",
    "url": "https://www.kaggle.com/competitions",
    "source_kind": "official-platform",
    "trust_tier": "official-api",
    "region_codes": ["GLOBAL"],
    "industries": ["ai-ml", "data-science"],
    "cadence_hours": 12,
    "enabled": false,
    "collector": { "type": "manual" },
    "notes": "优先使用 Kaggle 官方 API；接入凭据前保持手动。"
  },
  {
    "id": "devpost-hackathons",
    "name": "Devpost Hackathons",
    "url": "https://devpost.com/hackathons",
    "source_kind": "official-platform",
    "trust_tier": "trusted-platform",
    "region_codes": ["GLOBAL"],
    "industries": ["ai-ml", "innovation", "software"],
    "cadence_hours": 6,
    "enabled": false,
    "collector": { "type": "manual" },
    "notes": "赛事卡片由客户端加载；等待官方接口或专用适配器。"
  },
  {
    "id": "aicrowd-challenges",
    "name": "AIcrowd Challenges",
    "url": "https://www.aicrowd.com/challenges",
    "source_kind": "official-platform",
    "trust_tier": "trusted-platform",
    "region_codes": ["GLOBAL"],
    "industries": ["ai-ml", "data-science", "science-engineering"],
    "cadence_hours": 12,
    "enabled": true,
    "collector": {
      "type": "html-links",
      "title_keywords": ["challenge", "competition", "AI", "learning"],
      "link_patterns": ["/challenges/"],
      "match_mode": "all",
      "reject_past_years": true,
      "exclude_keywords": ["completed", "winner"],
      "same_host_only": true
    }
  },
  {
    "id": "drivendata-competitions",
    "name": "DrivenData Competitions",
    "url": "https://www.drivendata.org/competitions/",
    "source_kind": "official-platform",
    "trust_tier": "trusted-platform",
    "region_codes": ["GLOBAL"],
    "industries": ["ai-ml", "data-science", "public-good"],
    "cadence_hours": 12,
    "enabled": false,
    "collector": { "type": "manual" },
    "notes": "列表同时包含大量历史赛事；等待可识别开放状态的专用适配器。"
  },
  {
    "id": "zindi-competitions",
    "name": "Zindi Competitions",
    "url": "https://zindi.africa/competitions",
    "source_kind": "official-platform",
    "trust_tier": "trusted-platform",
    "region_codes": ["GLOBAL", "AFRICA"],
    "industries": ["ai-ml", "data-science", "public-good"],
    "cadence_hours": 12,
    "enabled": false,